<?xml version="1.0" encoding="UTF-8" ?>
<xs:schema xmlns:xs="http://www.w3.org/2001/XMLSchema">

    <xs:element name="product_list">
        <xs:complexType>
            <xs:sequence>
                <xs:element name="category" maxOccurs="unbounded">
                    <xs:complexType>
                        <xs:sequence>
                            <xs:element name="subcategory" maxOccurs="unbounded" minOccurs="0">
                                <xs:complexType>
                                    <xs:sequence>
                                        <xs:element name="article" maxOccurs="unbounded" minOccurs="0">
                                            <xs:complexType>
                                                <xs:sequence>
                                                    <xs:element name="manufacturer" type="xs:string"/>
                                                    <xs:element name="model">
                                                        <xs:simpleType>
                                                            <xs:restriction base="xs:string">
                                                                <xs:pattern value="[a-zA-Z][a-zA-Z][0-9][0-9][0-9]"/>
                                                            </xs:restriction>
                                                        </xs:simpleType>
                                                    </xs:element>
                                                    <xs:element name="production_date">
                                                        <xs:simpleType>
                                                            <xs:restriction base="xs:string">
                                                                <xs:pattern value="[0-9][0-9][-][0-9][0-9][-][0-9][0-9][0-9][0-9]"/>
                                                            </xs:restriction>
                                                        </xs:simpleType>
                                                    </xs:element>
                                                    <xs:element name="color" type="xs:string"/>
                                                    <xs:element name="price" type="xs:double"/>
                                                </xs:sequence>
                                                <xs:attribute name = "id" type="xs:long" use="required"/>
                                                <xs:attribute name = "stock" type="xs:int" use="required"/>
                                            </xs:complexType>
                                        </xs:element>
                                    </xs:sequence>
                                    <xs:attribute name = "id" type="xs:long" use="required"/>
                                    <xs:attribute name = "name" type="xs:string" use="required"/>
                                </xs:complexType>
                            </xs:element>
                        </xs:sequence>
                        <xs:attribute name = "id" type="xs:long" use="required"/>
                        <xs:attribute name = "name" type="xs:string" use="required"/>
                    </xs:complexType>
                </xs:element>
            </xs:sequence>
        </xs:complexType>
    </xs:element>

</xs:schema>